{
  "agent_name": "codex",
  "agent_role": "audit_review_verification",
  "artifact_sha256": {
    "01_projects/runtime_mvp/tests/test_n6_42b_shared_agent_handoffs.py": "6f9bb1c7d8e311644506d4ba49f332adcf0244990e5dd5327e90c09b7961d7bf",
    "03_scripts/context_memory/ghoti_handoff_packet.py": "f6af30115dc664a381a6a55349ef3ad66f915968206f00483c897d27e310f3b9"
  },
  "blockers": [],
  "branch": "feat/ghoti-agent-codex-n6-42b-shared-agent-handoffs",
  "commands_run": [
    "python 03_scripts/context_memory/ghoti_handoff_packet.py --check --json"
  ],
  "files_touched": [
    "03_scripts/context_memory/ghoti_handoff_packet.py",
    "14_context/memory/schemas/agent_handoff_packet.schema.json"
  ],
  "generated_at": "2026-06-11T19:00:00Z",
  "next_recommended_action": "Human reviews the packet before any merge or live action.",
  "packet_id": "codex-20260611-n6-42b-example",
  "safety": {
    "contains_secrets": false,
    "human_approval_required": true,
    "live_actions_executed": false
  },
  "schema_version": "1.0",
  "source_sha256": {
    "14_context/memory/index/raw_index.json": "070d5759e369a294121f602d5b9f250be362ab328cfb8f0a9c9194a53f9278a8"
  },
  "task": "Demonstrate the shared agent handoff packet contract.",
  "tests_failed": [],
  "tests_passed": [
    "example packet validates"
  ]
}
